[
  {
    "title": "2 + 5",
    "subtitle": "7 Ensayos sobre el arte",
    "author": [
      "Félix Ángel"
    ],
    "publishers": [
      "Tragaluz"
    ],
    "image": "/books/7_ensayos.webp"
  },
  {
    "title": "Abigael Bojórquez",
    "subtitle": "Correspondencia",
    "author": [
      "Gerardo Bustamante Bermúdez"
    ],
    "publishers": [
      "UACM"
    ],
    "image": "/books/abigael.webp"
  },
  {
    "title": "Allanamientos",
    "author": [
      "Sebastián Mederos"
    ],
    "publishers": [
      "Pez en el Hielo"
    ],
    "image": "/books/allanamientos.webp",
    "readDate": "2026-05-16"
  },
  {
    "title": "Archipiélago",
    "author": [
      "Mariana Enríquez"
    ],
    "publishers": [
      "Ampersand"
    ],
    "image": "/books/archipielago.webp",
    "readDate": "2026-06-13"
  },
  {
    "title": "Balún-Canán",
    "author": [
      "Rosario Castellanos"
    ],
    "publishers": [
      "FCE"
    ],
    "image": "/books/balun_canan.webp",
    "readDate": "2025-05-16"
  },
  {
    "title": "Cartas a Rosario",
    "author": [
      "Rosa Beltrán"
    ],
    "publishers": [
      "UNAM"
    ],
    "image": "/books/cartas_a_rosario.webp"
  },
  {
    "title": "Cartas a su madre",
    "author": [
      "Charles Baudelaire"
    ],
    "publishers": [
      "Blatt & Ríos"
    ],
    "image": "/books/cartas_madre.webp"
  },
  {
    "title": "Cartas a Vincent",
    "author": [
      "Julio César Pérez"
    ],
    "publishers": [
      "Zorro Rojo"
    ],
    "image": "/books/cartas_a_vincent.webp",
    "readDate": "2025-12-14"
  },
  {
    "title": "Cartas y poemas de amor entre Bioy y Elena",
    "subtitle": "Adolfo Bioy Casares en el archivo de Elena Garro",
    "author": [
      "Adolfo Bioy Casares",
      "Elena Garro"
    ],
    "publishers": [
      "BUAP",
      "El Lirio"
    ],
    "image": "/books/cartas_poemas.webp"
  },
  {
    "title": "Casa de clavos",
    "author": [
      "Sergio Vicencio"
    ],
    "publishers": [
      "Big Bang"
    ],
    "image": "/books/casa_de_clavos.webp"
  },
  {
    "title": "Contextual (1)",
    "subtitle": "Micro libros sobre diseño",
    "author": [
      "Formafantasma",
      "Koen Kleijn",
      "Joel Blanco",
      "Lucas Muñoz Muñoz"
    ],
    "publishers": [
      "Bartlebooth"
    ],
    "image": "/books/contextual.webp",
    "readDate": "2026-04-05"
  },
  {
    "title": "Correspondencia",
    "author": [
      "Victoria Ocampo",
      "Virginia Woolf"
    ],
    "publishers": [
      "Rara Avis"
    ],
    "image": "/books/correspondencia.webp"
  },
  {
    "title": "Correspondencia erótica",
    "author": [
      "Virginia Woolf",
      "Vita Sackville-West"
    ],
    "publishers": [
      "Rara Avis"
    ],
    "image": "/books/correspondencia_erotica.webp"
  },
  {
    "title": "Cuaderno de escritura infantil y juvenil",
    "subtitle": "20 grandes autores & 70 ejercicios de escritura",
    "author": [
      "Varios autores"
    ],
    "publishers": [
      "Factotum"
    ],
    "image": "/books/cuaderno_escritura.webp"
  },
  {
    "title": "Descubrimiento de Molgoria y diario de C",
    "author": [
      "Juan David Quintero Arenas"
    ],
    "publishers": [
      "Tragaluz"
    ],
    "image": "/books/descubrimiento.webp"
  },
  {
    "title": "Este minuto único y eterno",
    "subtitle": "El archivo privado de Rosario Castellanos",
    "author": [
      "Varios autores"
    ],
    "publishers": [
      "UNAM"
    ],
    "image": "/books/este_minuto.webp"
  },
  {
    "title": "Fieras interiores",
    "author": [
      "Andrés Cota Hiriart"
    ],
    "publishers": [
      "Random House"
    ],
    "image": "/books/fieras_interiores.webp"
  },
  {
    "title": "Final de temporada",
    "author": [
      "Diego Agudelo Gómez"
    ],
    "publishers": [
      "Tragaluz"
    ],
    "image": "/books/temporada.webp"
  },
  {
    "title": "Hetero",
    "author": [
      "Uxue Alberdi"
    ],
    "publishers": [
      "Consonni"
    ],
    "image": "/books/hetero.webp"
  },
  {
    "title": "Incensurable",
    "author": [
      "Luna Miguel"
    ],
    "publishers": [
      "UNAM",
      "Almadía"
    ],
    "image": "/books/incensurable.webp"
  },
  {
    "title": "Inundación",
    "subtitle": "El lenguaje secreto del que estamos hechos",
    "author": [
      "Eugenia Almeida"
    ],
    "publishers": [
      "DocumentA/Escénicas"
    ],
    "image": "/books/inundacion.webp",
    "readDate": "2025-12-09"
  },
  {
    "title": "La anarquía explicada a los niños",
    "author": [
      "José Antonio Emmanuel"
    ],
    "publishers": [
      "Zorro Rojo"
    ],
    "image": "/books/la_anarquia.webp"
  },
  {
    "title": "La filial",
    "author": [
      "Serguéi Dovlátov"
    ],
    "publishers": [
      "Fulgencio Pimentel"
    ],
    "image": "/books/la_filial.webp"
  },
  {
    "title": "Las gemelas, el sueño",
    "subtitle": "The twins, the dream",
    "author": [
      "Diana Bellessi",
      "Ursula K. Le Guin"
    ],
    "publishers": [
      "Rara Avis"
    ],
    "image": "/books/las_gemelas_el_sueno.webp"
  },
  {
    "title": "Lecciones de una pandemia",
    "subtitle": "Ideas para enfrentarse a los retos de salud planetaria",
    "author": [
      "Salvador Macip"
    ],
    "publishers": [
      "Anagrama"
    ],
    "image": "/books/pandemia.webp",
    "readDate": "2025-12-14"
  },
  {
    "title": "Lo roto precede a lo entero",
    "subtitle": "125 infraensayos",
    "author": [
      "Cristina Rivera Garza"
    ],
    "publishers": [
      "El Colegio Nacional"
    ],
    "image": "/books/roto.webp"
  },
  {
    "title": "Los platillos voladores, el proceso de la materia y la energía, la ciencia, la lucha de clases y revolucionaria y el futuro socialista de la humanidad",
    "author": [
      "J. Posadas"
    ],
    "publishers": [
      "Zorro Rojo"
    ],
    "image": "/books/los_platillos_voladores.webp"
  },
  {
    "title": "Marciano",
    "author": [
      "Nona Fernández"
    ],
    "publishers": [
      "Random House"
    ],
    "image": "/books/marciano.webp"
  },
  {
    "title": "Mujeres en bicicleta",
    "subtitle": "Lady Cycling",
    "author": [
      "F. J. Erskine"
    ],
    "publishers": [
      "Impronta"
    ],
    "image": "/books/mujeres_en_bicicleta.webp"
  },
  {
    "title": "Nuestro plan de fiesta",
    "subtitle": "Una correspondencia",
    "author": [
      "Camila Fabbri",
      "Jazmina Barrera"
    ],
    "publishers": [
      "Vinilo"
    ],
    "image": "/books/nuestro_plan_de_fiesta.webp",
    "readDate": "2025-12-05"
  },
  {
    "title": "Papeles suizos",
    "author": [
      "José Arenas"
    ],
    "publishers": [
      "Pez en el Hielo"
    ],
    "image": "/books/papeles_suizos.webp",
    "readDate": "2026-05-02"
  },
  {
    "title": "Pedagogías radicales y arte: experiencias comunales",
    "author": [
      "Varios autores"
    ],
    "publishers": [
      "Tumbalacasa"
    ],
    "image": "/books/pedagogias.webp"
  },
  {
    "title": "Pussypedia",
    "subtitle": "A Comprehensive Guide",
    "author": [
      "Zoe Mendelson",
      "María Conejo"
    ],
    "publishers": [
      "Hatchette"
    ],
    "image": "/books/pussypedia.webp"
  },
  {
    "title": "Terrestre",
    "author": [
      "Cristina Rivera Garza"
    ],
    "publishers": [
      "Random House"
    ],
    "image": "/books/terrestre.webp"
  },
  {
    "title": "Tlaltataca in ilnamiqui | Surcar el olvido",
    "subtitle": "Amoxtli xayacaxanehque | Álbum familiar",
    "author": [
      "Isela Xospa"
    ],
    "publishers": [
      "Xospatronik"
    ],
    "image": "/books/olvido.webp"
  },
  {
    "title": "Todos los fines del mundo",
    "author": [
      "Andrea Chapela"
    ],
    "publishers": [
      "Random House"
    ],
    "image": "/books/todos_los_fines_del_mundo.webp"
  },
  {
    "title": "Última carta a un lector",
    "author": [
      "Gerald Murnane"
    ],
    "publishers": [
      "Gris Tormenta"
    ],
    "image": "/books/carta_lector.webp"
  },
  {
    "title": "Una cartografía extraña",
    "subtitle": "Producciones narrativas entre la migración y el arte",
    "author": [
      "Lucía Egaña Rojas",
      "Paulina E. Varas"
    ],
    "publishers": [
      "Metales Pesados"
    ],
    "image": "/books/cartografia.webp"
  },
  {
    "title": "Ya nadie escribe cartas",
    "author": [
      "Jang Eun-jin"
    ],
    "publishers": [
      "Shiro"
    ],
    "image": "/books/nadie_escribe_cartas.webp",
    "readDate": "2026-09-03"
  }
]
